{
  "$schema": "https://json-schema.org/draft/2020-12/schema",
  "$id": "https://cy-llm.dev/schemas/manifests/training_revision.schema.json",
  "$comment": "MIGRATING_COMPATIBILITY: implemented v0 training lifecycle projection; frozen pending Yield-owned replacement.",
  "title": "TrainingRevision",
  "description": "An immutable, non-overwritable record of a single controlled training adjustment. Its `revision_id` is a content hash of the record with the `revision_id` field itself excluded (see schemas/CANONICALIZATION.md).",
  "type": "object",
  "additionalProperties": false,
  "required": [
    "run_id",
    "reason",
    "input_metrics",
    "decision_rule",
    "config_before",
    "config_after",
    "state_retention",
    "rolled_back",
    "actor"
  ],
  "properties": {
    "revision_id": {
      "type": "string",
      "description": "Computed content id, format 'sha256:<hex>'. EXCLUDED from the canonical hash preimage; treat as output only.",
      "pattern": "^sha256:[0-9a-f]{64}$"
    },
    "run_id": { "type": "string", "description": "Identifier of the training run this revision belongs to." },
    "parent_revision_id": {
      "type": "string",
      "description": "Reference to the previous revision in the chain, format 'sha256:<hex>' (absent for the first revision).",
      "pattern": "^sha256:[0-9a-f]{64}$"
    },
    "reason": { "type": "string", "description": "Why this adjustment was made, e.g. 'oom_recovery', 'throughput_tuning'." },
    "input_metrics": {
      "type": "object",
      "description": "Snapshot of the metrics that triggered/justified the adjustment.",
      "additionalProperties": true
    },
    "decision_rule": { "type": "string", "description": "Identifier of the rule/policy that produced the adjustment." },
    "config_before": {
      "type": "object",
      "description": "Relevant configuration before the adjustment.",
      "additionalProperties": true
    },
    "config_after": {
      "type": "object",
      "description": "Relevant configuration after the adjustment.",
      "additionalProperties": true
    },
    "base_checkpoint_id": {
      "type": "string",
      "description": "Reference to the checkpoint the revision resumes from, format 'sha256:<hex>' (optional).",
      "pattern": "^sha256:[0-9a-f]{64}$"
    },
    "state_retention": {
      "type": "object",
      "description": "Which pieces of training state were retained across the revision.",
      "additionalProperties": false,
      "required": ["model", "optimizer", "scheduler", "grad_scaler"],
      "properties": {
        "model": { "type": "boolean", "description": "Whether model weights were retained." },
        "optimizer": { "type": "boolean", "description": "Whether optimizer state was retained." },
        "scheduler": { "type": "boolean", "description": "Whether the LR scheduler state was retained." },
        "grad_scaler": { "type": "boolean", "description": "Whether the gradient scaler state was retained." }
      }
    },
    "canary_result": {
      "type": "object",
      "description": "Outcome snapshot of the canary run that gated this revision (optional).",
      "additionalProperties": true
    },
    "performance_delta": {
      "type": "object",
      "description": "Measured performance change attributed to this revision (optional).",
      "additionalProperties": true
    },
    "rolled_back": { "type": "boolean", "description": "Whether this revision was ultimately rolled back." },
    "actor": {
      "type": "string",
      "description": "Who/what initiated the revision.",
      "enum": ["user", "rule", "ai"]
    }
  }
}
